{
  "standard": [
    "*.abstract",
    "*.async",
    "*.declaration",
    "*.deprecated",
    "*.documentation",
    "*.modification",
    "*.readonly",
    "*.static",
    "class",
    "comment",
    "decorator",
    "enum",
    "enumMember",
    "event",
    "function",
    "function.defaultLibrary",
    "interface",
    "keyword",
    "macro",
    "method",
    "namespace",
    "number",
    "operator",
    "parameter",
    "property",
    "regexp",
    "string",
    "struct",
    "type",
    "typeParameter",
    "variable",
    "variable.abstract",
    "variable.async",
    "variable.declaration",
    "variable.defaultLibrary",
    "variable.definition",
    "variable.deprecated",
    "variable.documentation",
    "variable.modification",
    "variable.readonly",
    "variable.static"
  ],
  "sourceCode": [],
  "nonStandard": [
    "*.builtin",
    "*.callable",
    "*.classMember",
    "*.decorator",
    "*.escapeCharacter",
    "*.invalid",
    "*.keywordArgument",
    "*.library",
    "*.overridden",
    "*.typeHint",
    "*.typeHintComment",
    "arrow",
    "bracket",
    "builtinConstant",
    "clsParameter",
    "colon",
    "curlybrace",
    "intrinsic",
    "label",
    "magicFunction",
    "module",
    "parenthesis",
    "selfParameter",
    "semicolon",
    "defaultLibrary"
  ],
  "deprecated": []
}
